[
  {
    "code": "AF",
    "name": "Afghanistan",
    "flag": "🇦🇫",
    "enabled": false,
    "featured": false,
    "sortOrder": 1000
  },
  {
    "code": "AX",
    "name": "Aland",
    "flag": "🇦🇽",
    "enabled": false,
    "featured": false,
    "sortOrder": 1001
  },
  {
    "code": "AL",
    "name": "Albania",
    "flag": "🇦🇱",
    "enabled": false,
    "featured": false,
    "sortOrder": 1002
  },
  {
    "code": "DZ",
    "name": "Algeria",
    "flag": "🇩🇿",
    "enabled": false,
    "featured": false,
    "sortOrder": 1003
  },
  {
    "code": "AS",
    "name": "American Samoa",
    "flag": "🇦🇸",
    "enabled": false,
    "featured": false,
    "sortOrder": 1004
  },
  {
    "code": "AD",
    "name": "Andorra",
    "flag": "🇦🇩",
    "enabled": false,
    "featured": false,
    "sortOrder": 1005
  },
  {
    "code": "AO",
    "name": "Angola",
    "flag": "🇦🇴",
    "enabled": false,
    "featured": false,
    "sortOrder": 1006
  },
  {
    "code": "AI",
    "name": "Anguilla",
    "flag": "🇦🇮",
    "enabled": false,
    "featured": false,
    "sortOrder": 1007
  },
  {
    "code": "AQ",
    "name": "Antarctica",
    "flag": "🇦🇶",
    "enabled": false,
    "featured": false,
    "sortOrder": 1008
  },
  {
    "code": "AG",
    "name": "Antigua and Barbuda",
    "flag": "🇦🇬",
    "enabled": false,
    "featured": false,
    "sortOrder": 1009
  },
  {
    "code": "AR",
    "name": "Argentina",
    "flag": "🇦🇷",
    "enabled": false,
    "featured": false,
    "sortOrder": 1010
  },
  {
    "code": "AM",
    "name": "Armenia",
    "flag": "🇦🇲",
    "enabled": false,
    "featured": false,
    "sortOrder": 1011
  },
  {
    "code": "AW",
    "name": "Aruba",
    "flag": "🇦🇼",
    "enabled": false,
    "featured": false,
    "sortOrder": 1012
  },
  {
    "code": "AU",
    "name": "Australia",
    "flag": "🇦🇺",
    "enabled": false,
    "featured": false,
    "sortOrder": 1013
  },
  {
    "code": "AT",
    "name": "Austria",
    "flag": "🇦🇹",
    "enabled": false,
    "featured": false,
    "sortOrder": 1014
  },
  {
    "code": "AZ",
    "name": "Azerbaijan",
    "flag": "🇦🇿",
    "enabled": false,
    "featured": false,
    "sortOrder": 1015
  },
  {
    "code": "BS",
    "name": "Bahamas",
    "flag": "🇧🇸",
    "enabled": false,
    "featured": false,
    "sortOrder": 1016
  },
  {
    "code": "BH",
    "name": "Bahrain",
    "flag": "🇧🇭",
    "enabled": false,
    "featured": false,
    "sortOrder": 1017
  },
  {
    "code": "BD",
    "name": "Bangladesh",
    "flag": "🇧🇩",
    "enabled": false,
    "featured": false,
    "sortOrder": 1018
  },
  {
    "code": "BB",
    "name": "Barbados",
    "flag": "🇧🇧",
    "enabled": false,
    "featured": false,
    "sortOrder": 1019
  },
  {
    "code": "BY",
    "name": "Belarus",
    "flag": "🇧🇾",
    "enabled": false,
    "featured": false,
    "sortOrder": 1020
  },
  {
    "code": "BE",
    "name": "Belgium",
    "flag": "🇧🇪",
    "enabled": false,
    "featured": false,
    "sortOrder": 1021
  },
  {
    "code": "BZ",
    "name": "Belize",
    "flag": "🇧🇿",
    "enabled": false,
    "featured": false,
    "sortOrder": 1022
  },
  {
    "code": "BJ",
    "name": "Benin",
    "flag": "🇧🇯",
    "enabled": false,
    "featured": false,
    "sortOrder": 1023
  },
  {
    "code": "BM",
    "name": "Bermuda",
    "flag": "🇧🇲",
    "enabled": false,
    "featured": false,
    "sortOrder": 1024
  },
  {
    "code": "BT",
    "name": "Bhutan",
    "flag": "🇧🇹",
    "enabled": false,
    "featured": false,
    "sortOrder": 1025
  },
  {
    "code": "BO",
    "name": "Bolivia",
    "flag": "🇧🇴",
    "enabled": false,
    "featured": false,
    "sortOrder": 1026
  },
  {
    "code": "BQ",
    "name": "Bonaire",
    "flag": "🇧🇶",
    "enabled": false,
    "featured": false,
    "sortOrder": 1027
  },
  {
    "code": "BA",
    "name": "Bosnia and Herzegovina",
    "flag": "🇧🇦",
    "enabled": false,
    "featured": false,
    "sortOrder": 1028
  },
  {
    "code": "BW",
    "name": "Botswana",
    "flag": "🇧🇼",
    "enabled": false,
    "featured": false,
    "sortOrder": 1029
  },
  {
    "code": "BV",
    "name": "Bouvet Island",
    "flag": "🇧🇻",
    "enabled": false,
    "featured": false,
    "sortOrder": 1030
  },
  {
    "code": "BR",
    "name": "Brazil",
    "flag": "🇧🇷",
    "enabled": false,
    "featured": false,
    "sortOrder": 1031
  },
  {
    "code": "IO",
    "name": "British Indian Ocean Territory",
    "flag": "🇮🇴",
    "enabled": false,
    "featured": false,
    "sortOrder": 1032
  },
  {
    "code": "VG",
    "name": "British Virgin Islands",
    "flag": "🇻🇬",
    "enabled": false,
    "featured": false,
    "sortOrder": 1033
  },
  {
    "code": "BN",
    "name": "Brunei",
    "flag": "🇧🇳",
    "enabled": false,
    "featured": false,
    "sortOrder": 1034
  },
  {
    "code": "BG",
    "name": "Bulgaria",
    "flag": "🇧🇬",
    "enabled": false,
    "featured": false,
    "sortOrder": 1035
  },
  {
    "code": "BF",
    "name": "Burkina Faso",
    "flag": "🇧🇫",
    "enabled": false,
    "featured": false,
    "sortOrder": 1036
  },
  {
    "code": "BI",
    "name": "Burundi",
    "flag": "🇧🇮",
    "enabled": false,
    "featured": false,
    "sortOrder": 1037
  },
  {
    "code": "KH",
    "name": "Cambodia",
    "flag": "🇰🇭",
    "enabled": false,
    "featured": false,
    "sortOrder": 1038
  },
  {
    "code": "CM",
    "name": "Cameroon",
    "flag": "🇨🇲",
    "enabled": false,
    "featured": false,
    "sortOrder": 1039
  },
  {
    "code": "CA",
    "name": "Canada",
    "flag": "🇨🇦",
    "enabled": false,
    "featured": false,
    "sortOrder": 1040
  },
  {
    "code": "CV",
    "name": "Cape Verde",
    "flag": "🇨🇻",
    "enabled": false,
    "featured": false,
    "sortOrder": 1041
  },
  {
    "code": "KY",
    "name": "Cayman Islands",
    "flag": "🇰🇾",
    "enabled": false,
    "featured": false,
    "sortOrder": 1042
  },
  {
    "code": "CF",
    "name": "Central African Republic",
    "flag": "🇨🇫",
    "enabled": false,
    "featured": false,
    "sortOrder": 1043
  },
  {
    "code": "TD",
    "name": "Chad",
    "flag": "🇹🇩",
    "enabled": false,
    "featured": false,
    "sortOrder": 1044
  },
  {
    "code": "CL",
    "name": "Chile",
    "flag": "🇨🇱",
    "enabled": false,
    "featured": false,
    "sortOrder": 1045
  },
  {
    "code": "CN",
    "name": "China",
    "flag": "🇨🇳",
    "enabled": false,
    "featured": false,
    "sortOrder": 1046
  },
  {
    "code": "CX",
    "name": "Christmas Island",
    "flag": "🇨🇽",
    "enabled": false,
    "featured": false,
    "sortOrder": 1047
  },
  {
    "code": "CC",
    "name": "Cocos (Keeling) Islands",
    "flag": "🇨🇨",
    "enabled": false,
    "featured": false,
    "sortOrder": 1048
  },
  {
    "code": "CO",
    "name": "Colombia",
    "flag": "🇨🇴",
    "enabled": false,
    "featured": false,
    "sortOrder": 1049
  },
  {
    "code": "KM",
    "name": "Comoros",
    "flag": "🇰🇲",
    "enabled": false,
    "featured": false,
    "sortOrder": 1050
  },
  {
    "code": "CK",
    "name": "Cook Islands",
    "flag": "🇨🇰",
    "enabled": false,
    "featured": false,
    "sortOrder": 1051
  },
  {
    "code": "CR",
    "name": "Costa Rica",
    "flag": "🇨🇷",
    "enabled": false,
    "featured": false,
    "sortOrder": 1052
  },
  {
    "code": "HR",
    "name": "Croatia",
    "flag": "🇭🇷",
    "enabled": false,
    "featured": false,
    "sortOrder": 1053
  },
  {
    "code": "CU",
    "name": "Cuba",
    "flag": "🇨🇺",
    "enabled": false,
    "featured": false,
    "sortOrder": 1054
  },
  {
    "code": "CW",
    "name": "Curacao",
    "flag": "🇨🇼",
    "enabled": false,
    "featured": false,
    "sortOrder": 1055
  },
  {
    "code": "CY",
    "name": "Cyprus",
    "flag": "🇨🇾",
    "enabled": false,
    "featured": false,
    "sortOrder": 1056
  },
  {
    "code": "CZ",
    "name": "Czech Republic",
    "flag": "🇨🇿",
    "enabled": false,
    "featured": false,
    "sortOrder": 1057
  },
  {
    "code": "CD",
    "name": "Democratic Republic of the Congo",
    "flag": "🇨🇩",
    "enabled": false,
    "featured": false,
    "sortOrder": 1058
  },
  {
    "code": "DK",
    "name": "Denmark",
    "flag": "🇩🇰",
    "enabled": false,
    "featured": false,
    "sortOrder": 1059
  },
  {
    "code": "DJ",
    "name": "Djibouti",
    "flag": "🇩🇯",
    "enabled": false,
    "featured": false,
    "sortOrder": 1060
  },
  {
    "code": "DM",
    "name": "Dominica",
    "flag": "🇩🇲",
    "enabled": false,
    "featured": false,
    "sortOrder": 1061
  },
  {
    "code": "DO",
    "name": "Dominican Republic",
    "flag": "🇩🇴",
    "enabled": false,
    "featured": false,
    "sortOrder": 1062
  },
  {
    "code": "TL",
    "name": "East Timor",
    "flag": "🇹🇱",
    "enabled": false,
    "featured": false,
    "sortOrder": 1063
  },
  {
    "code": "EC",
    "name": "Ecuador",
    "flag": "🇪🇨",
    "enabled": false,
    "featured": false,
    "sortOrder": 1064
  },
  {
    "code": "EG",
    "name": "Egypt",
    "flag": "🇪🇬",
    "enabled": false,
    "featured": false,
    "sortOrder": 1065
  },
  {
    "code": "SV",
    "name": "El Salvador",
    "flag": "🇸🇻",
    "enabled": false,
    "featured": false,
    "sortOrder": 1066
  },
  {
    "code": "GQ",
    "name": "Equatorial Guinea",
    "flag": "🇬🇶",
    "enabled": false,
    "featured": false,
    "sortOrder": 1067
  },
  {
    "code": "ER",
    "name": "Eritrea",
    "flag": "🇪🇷",
    "enabled": false,
    "featured": false,
    "sortOrder": 1068
  },
  {
    "code": "EE",
    "name": "Estonia",
    "flag": "🇪🇪",
    "enabled": false,
    "featured": false,
    "sortOrder": 1069
  },
  {
    "code": "ET",
    "name": "Ethiopia",
    "flag": "🇪🇹",
    "enabled": false,
    "featured": false,
    "sortOrder": 1070
  },
  {
    "code": "FK",
    "name": "Falkland Islands",
    "flag": "🇫🇰",
    "enabled": false,
    "featured": false,
    "sortOrder": 1071
  },
  {
    "code": "FO",
    "name": "Faroe Islands",